id,the_snippet,the_headline,the_date,the_news_desk
1059,"A deal for the current owners to sell control of the team to the hedge fund billionaire fell apart, but the Wilpon family is still looking for a buyer.",A ‘Disappointed’ Steve Cohen Walks Away From Mets Purchase,2020-02-06T17:55:21+0000,Sports
1060,"Just ahead of fashion week, galas for amfAR and the Germanistic Society of America.",Belles of the Ball,2020-02-07T17:00:20+0000,Styles
1061,"The last direct descendant of the author of “Ulysses” and “Finnegans Wake” was a fierce protector of James Joyce’s estate, to the frustration of scholars.",Stephen Joyce Dies at 87; Guarded Grandfather’s Literary Legacy,2020-02-07T20:39:18+0000,Obits
1062,"A key figure in New York’s creative underground of the 1970s, he was also a filmmaker who chronicled the early days of the punk scene.","Ivan Kral, Rocker With Patti Smith and Others, Is Dead at 71",2020-02-05T22:10:28+0000,Obits
1063,"A deal for the current owners to sell control of the team to the hedge fund billionaire fell apart, but the Wilpon family is still looking for a buyer.",A ‘Disappointed’ Steve Cohen Walks Away From Mets Purchase,2020-02-06T17:55:21+0000,Sports
1064,"Just ahead of fashion week, galas for amfAR and the Germanistic Society of America.",Belles of the Ball,2020-02-07T17:00:20+0000,Styles
1065,"The last direct descendant of the author of “Ulysses” and “Finnegans Wake” was a fierce protector of James Joyce’s estate, to the frustration of scholars.",Stephen Joyce Dies at 87; Guarded Grandfather’s Literary Legacy,2020-02-07T20:39:18+0000,Obits
1066,"A key figure in New York’s creative underground of the 1970s, he was also a filmmaker who chronicled the early days of the punk scene.","Ivan Kral, Rocker With Patti Smith and Others, Is Dead at 71",2020-02-05T22:10:28+0000,Obits
1067,Jake Halperin is at bat for our Thursday puzzle.,Goes to the Plate,2020-02-06T03:00:06+0000,Games
1068,The senator from Utah was the first — and only — Republican to announce he supported removing the president from office.,Full Transcript: Mitt Romney’s Speech Announcing Vote to Convict Trump,2020-02-05T22:18:39+0000,Washington
1069,Every first-time parent in the city will soon be eligible to receive as many as six home visits from professionals.,1 in 5 Mothers Gets Postpartum Depression. New York City Plans to Help.,2020-02-05T15:56:06+0000,Metro
1070,"Corrections that appeared in print on Thursday, Feb. 6, 2020.","Corrections: Feb. 6, 2020",2020-02-06T01:42:21+0000,Corrections
1071,Impeachment will end in the Senate. It’s time to take up consensus issues.,Why I’m Voting to Acquit President Trump,2020-02-05T10:00:20+0000,OpEd
1072,"Regardless of the Senate’s verdict, the impeachment inquiry, President Trump’s own words and other revelations yield a narrative establishing his involvement in the pressure campaign.","Beyond the Partisan Fight, a Wealth of Evidence About Trump and Ukraine",2020-02-05T08:00:12+0000,Washington
1073,"The Times sent a survey to the presidential candidates about matters of war and peace, diplomacy and national security.",North Korea - Foreign Policy,2020-02-07T03:57:13+0000,U.S.
1074,"The Times sent a survey to the presidential candidates about matters of war and peace, diplomacy and national security.",Tom Steyer - Foreign Policy,2020-02-07T03:57:08+0000,U.S.
1075,"A key figure in New York’s creative underground of the 1970s, he was also a filmmaker who chronicled the early days of the punk scene.","Ivan Kral, Rocker With Patti Smith and Others, Is Dead at 71",2020-02-05T22:10:28+0000,Obits
1076,"His 1972 book about his beloved Brooklyn Dodgers, acknowledged as a classic, was, like many of his 20 or so other books, steeped in memories of his boyhood.","Roger Kahn, Who Lifted Sportswriting With ‘Boys of Summer,’ Dies at 92",2020-02-07T15:35:34+0000,Obits
1077,"His claims of a secret deal come at a sensitive time for the government, which is under international pressure to cut ties with terror groups.","Taliban Militant Flees Prison, Claiming Deal With Pakistani Security Forces",2020-02-07T16:22:18+0000,Foreign
1078,The courses reflect a broader realization that ‘people are responsible for their own financial future.',More States Require Students to Learn About Money Matters,2020-02-07T14:00:07+0000,Business
1079,President Aleksandr G. Lukashenko pressed for cheap energy to aid his ailing economy during a “moment of truth” meeting with President Putin.,"Putin Rejects Oil Deal With Belarus, Increasing Pressure for Merger",2020-02-07T12:18:45+0000,Foreign
1080,An artist illustrates her fascination with a frightening book.,What Happens When Flowers Have Too Much Power?,2020-02-07T10:00:29+0000,BookReview
1081,Here’s what you need to know.,"Coronavirus, Iowa, Ireland: Your Friday Briefing",2020-02-07T05:15:43+0000,NYTNow
1082,The change could mean one less financial barrier to securing housing in a city where rents are high and affordable apartments are scarce.,Broker Fee Ban: What It Means for Renters,2020-02-07T10:15:45+0000,Metro
1083,"They are sturdy enough to stack, sandwich in s’mores or melt in hot chocolate, but tender, with skin as soft as a petal.",The Sensuous Pleasures of Handmade Marshmallows,2020-02-05T17:22:05+0000,Magazine
1084,She will shift her focus to her broadcasting role for ESPN.,Jessica Mendoza Will Leave Mets Job,2020-02-07T18:35:42+0000,Sports
1085,The comedian Conner O’Malley indicts the greed that built Manhattan’s $25 billion corporate fantasia.,Hudson Yards Is Coming for Your Soul,2020-02-06T21:18:44+0000,Magazine
1086,"The actress, who has returned to television with a CBS police drama, puts CNN, ABC Carpet & Home and her father’s sculptures on her list of essentials.","Edie Falco Can’t Quit CNN, but Jazz and a Dog Park Keep Her Sane",2020-02-05T15:00:08+0000,Arts&Leisure
1087,Did you follow the headlines this week?,"News Quiz: Iowa Caucuses, Impeachment Trial, Coronavirus",2020-02-07T08:30:04+0000,Briefing
1088,Here’s what you need to know.,"Pete Buttigieg, Coronavirus, Tesla: Your Wednesday Briefing",2020-02-05T05:40:52+0000,NYTNow
1089,"The U.S. prosecution of Mexican politicians for drug trafficking could help President López Obrador fight corruption, but he’s failing to build on it.",Dismantling Mexico’s Narco State,2020-02-05T10:00:21+0000,OpEd
1090,"Sure, contactless payment systems are easier. Whether using your phone or a credit card, the technology is also a more secure way to pay for purchases.",A Case for Paying With Your Phone,2020-02-05T10:00:21+0000,Travel
1091,"Results trickled in, and the candidates recalibrated. This is your morning tip sheet.",On Politics: Still Talking About Iowa,2020-02-05T12:35:56+0000,Politics
1092,President Trump’s State of the Union Speech was marked by optimism and made-for-TV moments — but his tense relationship with Speaker Nancy Pelosi was also on display.,Highlights (and Snubs) From Trump’s State of the Union Speech,2020-02-05T07:22:06+0000,
1093,"An app used to record votes was faulty and largely untested, but the glitches weren’t the only reasons for a major delay in results in the first-in-the-nation presidential contest.",Here’s a List of Everything That Went Wrong at the Iowa Caucuses,2020-02-05T01:02:00+0000,U.S.
1094,A Lego competition series debuts on Fox. And “Expedition Unknown” returns for another season on Discovery Channel.,What’s on TV Wednesday: ‘Lego Masters’ and ‘Expedition Unknown’,2020-02-05T06:00:06+0000,Culture
1095,Feeling a little overwhelmed by everything that’s happening? You’re not alone.,The Hot Mess Express,2020-02-05T00:38:56+0000,Politics
1096,President Trump spoke of a “great American comeback” in his third State of the Union address.,Full Transcript: Trump’s 2020 State of the Union Address,2020-02-05T05:31:58+0000,Washington
1097,Impeachment will end in the Senate. It’s time to take up consensus issues.,Why I’m Voting to Acquit President Trump,2020-02-05T10:00:20+0000,OpEd
1098,"Regulators unexpectedly banned broker fees for renters, which in the city have long amounted to as much as 15 percent of the annual lease.",Surprise for New York Renters: No More Broker Fees,2020-02-05T23:15:37+0000,Metro
1099,How to actually make it the best part of waking up.,5 Cheap(ish) Things to Make the Perfect Cup of Coffee,2020-02-06T02:48:08+0000,Smarter Living
1100,"Evacuees taken to Australia’s Christmas Island, a former detention center for asylum seekers, have been given sunscreen, sandals and shorts. They also have video games.",What It’s Like to Be Quarantined on an Island Over Coronavirus Fears,2020-02-06T14:57:16+0000,Foreign
1101,"In pop culture, women are often objectified and disposed of. But even when we’re not being victimized, the alternative leaves much to be desired.",I Don’t Want to Be the Strong Female Lead,2020-02-07T10:00:40+0000,OpEd
1102,The documentary branch this year became the first to achieve gender parity since the #OscarsSoWhite hashtag pressured the Academy to diversify its membership.,The Bright Spot for Women at the Oscars,2020-02-07T19:05:31+0000,Gender
1103,"Though a breakthrough for law enforcement, the technique could allow the little-known start-up to collect an extraordinarily sensitive set of data and images.",Clearview’s Facial Recognition App Is Identifying Child Victims of Abuse,2020-02-07T15:06:34+0000,Business
1104,The Justice Department has told four carmakers that they violated no laws when they negotiated a fuel economy standard with California that is more stringent than Washington’s.,Justice Department Drops Antitrust Probe Against Automakers That Sided With California on Emissions,2020-02-07T21:04:30+0000,Climate
1105,Tania León worked for the New York Philharmonic in the 1990s. But the full orchestra is only now performing her work.,"A Composer Puts Her Life in Music, Beyond Labels",2020-02-07T15:00:10+0000,Arts&Leisure
1106,"More than a century ago, the Red Sox dealt away an M.V.P. Award-winning outfielder over financial concerns: Tris Speaker, who has eerie parallels to Betts.",Mookie Betts Deal Offers Painful Reminders of Boston’s Past,2020-02-06T12:30:07+0000,Sports
1107,"He has called his campaign “the journey of my life.” But what got lost in the novelty of his bid, former employees say, was scrutiny of his life before this particular journey.",What It Was Like to Work for Andrew Yang,2020-02-07T10:00:33+0000,Politics
1108,"His rugged good looks and muscular intensity made him a commanding presence in films like “Lust for Life,” “Spartacus” and “Paths of Glory.”","Kirk Douglas, a Star of Hollywood’s Golden Age, Dies at 103",2020-02-05T23:54:21+0000,Obits
1109,"In the next film from our Sundance 2020 series, two brothers carve their community’s first totem pole in nearly a century.",Now Is the Time,2020-02-05T20:04:24+0000,
1110,"“The title evokes yoga for me and, much as I love yoga, I am allergic to books with a namaste vibe.”",Why Gish Jen Hasn’t Read One of the Most Acclaimed Books of 2019,2020-02-06T10:00:06+0000,BookReview
1111,Our expert has been closely tracking the awards races all season. Here are the movies and stars he expects to win.,"Oscars 2020 Predictions: Who Will Win Best Picture, Actor and Actress",2020-02-06T19:26:50+0000,Weekend
1112,Analyzing digital streams of information from electric scooters and motor-assisted bicycles is helping solve travel congestion issues.,Data Driving New Approaches to Transportation,2020-02-05T10:00:14+0000,SpecialSections
1113,"Playhouse Bar, which opened a block from Stonewall, is filled with drag and dancing.","Yes, There’s a New Gay Bar in Greenwich Village",2020-02-05T10:00:10+0000,Styles
1114,The “Brooklyn Nine-Nine” actor reads an essay about loving two people at the same time.,"Modern Love Podcast: Terry Crews Reads ‘Dedicated to Two Women, Only One of Them Alive’",2020-02-05T22:06:35+0000,Styles
1115,"Five years ago, #OscarsSoWhite rewrote the narrative in an industry with entrenched disparities. Here, Spike Lee, Ava DuVernay and other insiders tell the story as they lived it.",The Hashtag That Changed the Oscars: An Oral History,2020-02-06T10:00:21+0000,Arts&Leisure
1116,"The indie rocker Bethany Cosentino got sober, broke her writer’s block and made a powerful new album, “Always Tomorrow.”",Best Coast Almost Had No Future. Now Everything Has Changed.,2020-02-06T15:00:09+0000,Arts&Leisure
1117,"Bruce Schneider has been a grower, a producer, a marketer and an innovator. But mostly he’s been a true believer in the potential of one red grape.",He’s in a Cab Franc State of Mind,2020-02-06T18:33:57+0000,Dining
1118,"Biometric sensors are getting lighter, cheaper and more accurate, and could help warn drivers before they become too fatigued.",Wearable Tech That Tells Drowsy Truckers It’s Time to Pull Over,2020-02-06T11:00:09+0000,Business
1119,"Like SpaceX, the company aims to build a constellation of internet satellites, but its orbiters could interfere with telescopes on Earth.",OneWeb Launches 34 Satellites as Astronomers Fear Radio Chatter,2020-02-06T16:51:50+0000,Science
1120,"On Samos, islanders and asylum seekers bear the shared brunt of forces beyond their control — like chaos in the Middle East and the cold shoulder of the European Union.",The Scenic Isle Where the World’s Chaos Comes Home to Roost,2020-02-07T10:00:45+0000,Foreign
1121,Skip the wait and the crowds. Stay home and cook for the people you love.,"Our Best Valentine’s Day Recipes: Lobster, Steak, Chocolate and More",2020-02-07T21:05:26+0000,Dining
1122,"Spermicides, tingling gel and other condom add-ons may do more harm than good.",Condoms With Extras? No Thanks,2020-02-07T16:25:28+0000,Smarter Living
1123,SIGAR’s 46th quarterly report sketched how the United States is propping up a corrupt and weak pauper state.,"The Limits of U.S. Strategy in Afghanistan, by the Numbers",2020-02-07T15:38:59+0000,Magazine
1124,"Playhouse Bar, which opened a block from Stonewall, is filled with drag and dancing.","Yes, There’s a New Gay Bar in Greenwich Village",2020-02-05T10:00:10+0000,Styles
1125,"His rugged good looks and muscular intensity made him a commanding presence in films like “Lust for Life,” “Spartacus” and “Paths of Glory.”","Kirk Douglas, a Star of Hollywood’s Golden Age, Dies at 103",2020-02-05T23:54:21+0000,Obits
1126,"There are now 12 confirmed cases in the United States, as Wisconsin says it has its first case. The death toll rose by more than 60 people in China.","As China Clamps Down on Negative News, Quarantines on Land and Sea",2020-02-05T05:02:36+0000,Foreign
1127,"At a State of the Union watch party in Michigan, the president’s most loyal supporters dug in their heels.",The Trump Fans Who Think Impeachment Was ‘Exactly’ What His Base Needed,2020-02-05T17:49:14+0000,Politics
1128,"Jamison talks about Offill’s new novel, and Courtney Maum talks about “Before and After the Book Deal.”",Leslie Jamison on Jenny Offill’s ‘Weather’,2020-02-07T23:05:23+0000,Books
1129,A guest appearance at the State of the Union and meeting at the White House put to rest talk that President Trump had lost patience with Juan Guaidó’s campaign to oust Nicolás Maduro.,Trump Gives Venezuela’s Guaidó the Embrace He Wanted,2020-02-06T01:17:49+0000,Washington
1130,"The heroine of Kate Chopin’s “The Awakening” begins to notice what she wants, rather than what her male-dominated society wants her to want.",The Classic Novel That Saw Pleasure as a Path to Freedom,2020-02-05T21:45:40+0000,BookReview
1131,Two brothers have given everything to treat raptors injured by a popular pastime.,Meet the Bird Medics of New Delhi,2020-02-07T10:00:44+0000,Science
1132,"In this lesson, students will see how “Sesame Street” is being brought to a new community and apply media literacy skills to children’s television.",Lesson of the Day: ‘Sesame Street’ Is Opening Up to Syrian Refugees,2020-02-05T09:00:02+0000,Learning
1133,"In this lesson, students will see how “Sesame Street” is being brought to a new community and apply media literacy skills to children’s television.",Lesson of the Day: ‘Sesame Street’ Is Opening Up to Syrian Refugees,2020-02-05T09:00:02+0000,Learning
1134,Luxurious weekend snoozing should be a parental right.,‘Dad Naps’ for Everyone,2020-02-05T13:54:54+0000,Parenting
1135,The Nigerian foreign minister said he learned about the ban just before a meeting with the United States to expand cooperation. But he said American officials had signaled it could soon be lifted.,"Nigeria ‘Blindsided’ by Trump Travel Ban, Its Top Diplomat Says",2020-02-05T00:38:30+0000,Washington
1136,"The introduction of the early signing period has proved popular among coaches, recruits and parents. For many programs, February may be too late to sign the top players.",College Football Prospects Actually Signing on Signing Day? That’s So 2017,2020-02-05T08:00:07+0000,Sports
1137,"Mr. Morales, the former president of Bolivia, is now living in Argentina and facing an arrest warrant in his homeland. His bid for the Senate could further roil a bitterly divided nation.","Evo Morales, Now in Exile, to Run for Bolivia’s Senate",2020-02-05T00:13:59+0000,Foreign
1138,But his speech had the surreal quality of a president on trial for high crimes and misdemeanors addressing lawmakers in the chamber where he was impeached just seven weeks ago.,"Assured of Acquittal, Trump Makes Case for a Second Term",2020-02-05T05:00:08+0000,Washington
1139,"Quotation of the Day for Wednesday, February 5, 2020.",Quotation of the Day: How Caucuses Sank Into a ‘Disaster’,2020-02-05T04:46:27+0000,Summary
1140,"Mr. Rustin, who died in 1987, helped plan the Montgomery bus boycott and the March on Washington, but his legacy was tarnished by a 1953 conviction under laws targeting L.G.B.T.Q. people.","Bayard Rustin, Gay Civil Rights Leader, Is Pardoned in California",2020-02-05T17:45:21+0000,Express
1141,"In a unique political moment, the president’s annual address had echoes of a campaign rally.",The State of the Union,2020-02-05T10:58:18+0000,Podcasts
1142,"In a pair of historic votes, 52 to 48 and 53 to 47, senators acquitted President Trump of two charges: abuse of power and obstruction of Congress.",Senate Votes to Acquit President Trump,2020-02-05T21:51:33+0000,
1143,Our guide to cultural events in New York City for children and teenagers happening this weekend and in the week ahead.,8 Things to Do With Your Kids in N.Y.C. This Weekend,2020-02-06T22:00:05+0000,Weekend
1144,Here’s what would probably happen if the Iowa Democrats bowed to the demand by the Democratic National Committee’s chairman to double-check the results from the caucuses.,What Would a ‘Recanvass’ in Iowa Look Like?,2020-02-06T20:04:22+0000,Politics
1145,"Mr. Biden has gone on the offensive, taking aim at two rivals ahead of him in the Iowa results, Pete Buttigieg and Bernie Sanders, while Ms. Warren continues to stress unity.","Biden and Warren Seek Revival, With Two Very Different Strategies",2020-02-06T01:05:07+0000,Politics
1146,"A day after his acquittal, the president took a victory lap, and vented, in a wild White House speech.",Impeachment Briefing: Trump’s Celebration,2020-02-07T00:17:19+0000,Washington
1147,How people living on the outskirts of an epidemic are navigating life.,Minimizing Risk in a Global Panic,2020-02-07T02:22:53+0000,Foreign
1148,A recent study found the U.S. cities where the most residents stay put for decades on end — but not for the same reasons.,Here Are the Cities Homeowners Never Leave,2020-02-06T14:30:04+0000,RealEstate
1149,"For this issue, a look at Trump's lender of last resort.",Behind the Cover: Deutsche Bank and Trump,2020-02-06T22:18:20+0000,Magazine
1150,Everyone is really sorry about what happened in Iowa. But nobody will take the blame.,Who Killed the Caucuses?,2020-02-07T00:39:01+0000,Politics
1151,Should a man be digging through his wife’s refuse?,Judge John Hodgman on Inspecting Your Wife’s Garbage,2020-02-06T10:00:01+0000,Magazine
1152,"A deal would have a limited impact on the American economy, but the Trump administration sees it as an important geopolitical move.",U.S. to Start Trade Talks With Kenya to Counter China’s Influence,2020-02-06T22:49:44+0000,Washington
1153,And Sienna Miller drinks to the Writers Guild of America.,‘Homeland’ Toasts Its Final Season,2020-02-05T20:31:15+0000,Styles
1154,See how each senator will vote on whether to convict and remove President Trump from office.,Trump Impeachment Results: How Democrats and Republicans Voted,2020-02-05T20:08:44+0000,U.S.
1155,"A moment on a sidewalk becomes a koan, a fragment bearing a mysterious pronoun. ",Poem: Parrot,2020-02-06T10:00:04+0000,Magazine
1156,The Times movie critic A.O. Scott looks back at the career of the actor Kirk Douglas. Mr. Douglas achieved enormous success in the 1950s and ’60s and was comfortable in a variety of genres.,Kirk Douglas: Last of Hollywood’s Golden Age,2020-02-05T23:54:17+0000,Obits
1157,Here's what you need to know.,"Donald Trump, Iowa Caucus, Kirk Douglas: Your Thursday Briefing",2020-02-06T10:30:55+0000,NYTNow
1158,And the two best.,The 4 Worst Acquittal Arguments,2020-02-06T13:29:47+0000,OpEd
1159,Lauren Young is the sixth and final woman to take the stand against Mr. Weinstein at his rape trial.,"Weinstein ‘Trapped’ and Assaulted Model in Bathroom, She Testifies",2020-02-05T16:14:29+0000,Metro
1160,Critics fear uncontacted tribes may suffer “irreparable damage” after President Jair Bolsonaro appointed an anthropologist who is also an evangelical preacher to lead the National Indian Foundation.,Will an Ex-Missionary Shield Brazil’s Tribes From Outsiders?,2020-02-06T00:15:11+0000,Foreign
1161,"Diminished in scope but not ambition, the men’s shows prove that even the malling of Manhattan can’t dampen designers’ spirit.",Men’s Wear Flies Its Freak Flag,2020-02-05T17:03:33+0000,Styles
1162,Bill de Blasio wants to tackle homelessness and the property tax system in his final two years in office. But his clout is in question.,Can a Lame Duck Mayor Get New Yorkers to Believe in Him Again?,2020-02-06T08:00:08+0000,Metro
1163,"A day after his acquittal, the president took a victory lap, and vented, in a wild White House speech.",Impeachment Briefing: Trump’s Celebration,2020-02-07T00:17:19+0000,Washington
1164,How people living on the outskirts of an epidemic are navigating life.,Minimizing Risk in a Global Panic,2020-02-07T02:22:53+0000,Foreign
1165,"Like lessons of all great teachers, hers continue to resonate.",Alice Mayhew Taught Me How to Work With Words,2020-02-06T00:00:06+0000,OpEd
1166,The growing extremism of the debate alienates many people on the left and right.,How Abortion Warps Our Politics,2020-02-06T00:00:06+0000,OpEd
1167,"Mr. Biden has gone on the offensive, taking aim at two rivals ahead of him in the Iowa results, Pete Buttigieg and Bernie Sanders, while Ms. Warren continues to stress unity.","Biden and Warren Seek Revival, With Two Very Different Strategies",2020-02-06T01:05:07+0000,Politics
1168,"For this issue, a look at Trump's lender of last resort.",Behind the Cover: Deutsche Bank and Trump,2020-02-06T22:18:20+0000,Magazine
1169,"The Treasury Department complied with a request from Senate Republicans for documents related to Hunter Biden’s ties to a Ukrainian energy company, according to a Senate Democrat.",Republicans in Senate Press On With Investigation Into Hunter Biden,2020-02-06T19:50:27+0000,Washington
1170,A recent study found the U.S. cities where the most residents stay put for decades on end — but not for the same reasons.,Here Are the Cities Homeowners Never Leave,2020-02-06T14:30:04+0000,RealEstate
1171,Here’s what would probably happen if the Iowa Democrats bowed to the demand by the Democratic National Committee’s chairman to double-check the results from the caucuses.,What Would a ‘Recanvass’ in Iowa Look Like?,2020-02-06T20:04:22+0000,Politics
1172,New research challenges assumptions about the negative effects of social media and smartphones on children. We asked teenagers whether their parents should worry about how much time they spend on their devices.,"What Students Are Saying About How Much They Use Their Phones, and Whether We Should Be Worried",2020-02-06T21:50:16+0000,Learning
1173,Our roundup of the news stories and features about young people that have recently appeared across sections of NYTimes.com.,Teenagers in The Times: January 2020,2020-02-06T22:04:37+0000,Learning
1174,Everyone is really sorry about what happened in Iowa. But nobody will take the blame.,Who Killed the Caucuses?,2020-02-07T00:39:01+0000,Politics
1175,Should a man be digging through his wife’s refuse?,Judge John Hodgman on Inspecting Your Wife’s Garbage,2020-02-06T10:00:01+0000,Magazine
1176,The big activist hedge fund is urging SoftBank to buy back stock and change its governance to drive up its stock price.,Elliott Management Is Said to Push for Change at SoftBank,2020-02-06T23:02:11+0000,Business
1177,"The storm could thrash small towns with winds of up to 140 miles per hour, a meteorologist said.",Australia’s West Coast Braces for Tropical Cyclone Damien,2020-02-07T06:56:24+0000,Foreign
1178,Readers respond to recent issues of the Sunday Book Review.,Letters to the Editor,2020-02-07T10:00:04+0000,BookReview
1179,Six new paperbacks to check out this week.,New in Paperback: ‘Bad Blood’ and ‘Lost Children Archive’,2020-02-07T10:00:01+0000,BookReview
1180,"Attention turns fully to November, and Biden admits a “gut punch.” This is your morning tip sheet.",On Politics: Acquitted. What’s Next?,2020-02-06T12:02:11+0000,Politics
