id,the_snippet,the_headline,the_date,the_news_desk
3179,Will Ferrell and Julia Louis-Dreyfus star in this timid remake of a dark Swedish vacation comedy.,‘Downhill’ Review: A Small Disaster in the Snow,2020-02-13T13:19:24+0000,Weekend
3180,"They cannot prove the existence of heaven or hell, but they can give us hope.",Are ‘Near-Death Experiences’ Real?,2020-02-13T20:00:07+0000,OpEd
3181,"Whether you’re sentimental or rom-com averse, our culture writers offer suggestions for a range of interests.",What to Stream on Valentine’s Day,2020-02-14T03:26:42+0000,Weekend
3182,"Check out our cool new recipe collection devoted to single-vessel cooking — just one pot, pan or skillet — and follow it up with an anchovy martini.",What to Cook This Weekend,2020-02-14T15:30:01+0000,Dining
3183,"Fun choices abound this Valentine’s Day weekend, especially for those who find history sexy.",How Much Watching Time Do You Have This Weekend?,2020-02-13T22:47:30+0000,Weekend
3184,Will Ferrell and Julia Louis-Dreyfus star in this timid remake of a dark Swedish vacation comedy.,‘Downhill’ Review: A Small Disaster in the Snow,2020-02-13T13:19:24+0000,Weekend
3185,Joe Biden is looking ahead to South Carolina to resurrect his candidacy. There are signs that it may be a bigger challenge after defeats in Iowa and New Hampshire.,Biden Needs Black Voters to Lift His Campaign. But He Has Competition.,2020-02-13T10:00:26+0000,Politics
3186,"Adapted from a Joan Didion novel, the movie plunges Anne Hathaway into the 1980s turmoil around the U.S. backing of Nicaraguan rebels.",‘The Last Thing He Wanted’ Review: Gun Running and Anxiety,2020-02-13T12:00:04+0000,Weekend
3187,"The lakes are hitting record levels and lakefront communities are asking, what’s next?","Along the Great Lakes, It’s Time to Prepare for Extremes",2020-02-13T20:07:55+0000,OpEd
3188,"The billionaire drew condemnation for his newly surfaced comments on redlining, in which banks discriminated against people of color seeking to borrow money to afford homes.",Bloomberg Once Linked 2008 Crisis to End of Redlining Bias in Home Loans,2020-02-13T19:20:07+0000,Politics
3189,"Check out our cool new recipe collection devoted to single-vessel cooking — just one pot, pan or skillet — and follow it up with an anchovy martini.",What to Cook This Weekend,2020-02-14T15:30:01+0000,Dining
3190,"She was a sadistic Nazi doctor in “Ilsa: She Wolf of the SS,” a 1975 sexploitation movie that has achieved cult status, then returned in several sequels.","Dyanne Thorne, 83, Star of Scandalous ‘Ilsa’ Films, Is Dead",2020-02-13T20:40:10+0000,Obits
3191,"Breaking hearts, brains and bank accounts since at least the 14th century.",Valentine’s Day: A Festival of Love or a Giant Scam?,2020-02-13T23:10:15+0000,OpEd
3192,"This week’s properties are in Park Slope, Brooklyn, Woodside, Queens, and on the Upper West Side.","Homes for Sale in Brooklyn, Queens and Manhattan",2020-02-13T14:00:24+0000,RealEstate
3193,Airbus can’t easily capitalize on the grounding of archrival Boeing’s best-selling plane.,"As Boeing Jets Sit Idle, Airbus Can’t Make Planes Fast Enough",2020-02-13T19:39:52+0000,Business
3194,The actress’s “woo” approach to health is variously criticized and applauded. Also: Trump’s hostility to Europe; storing federal records.,"Gwyneth Paltrow’s Goop Arts, and Science",2020-02-13T20:03:22+0000,Letters
3195,"Under the plan, the hedge fund Chatham Asset Management would take over 30 newspapers nationwide, including The Sacramento Bee and The Miami Herald.","McClatchy, a Major U.S. Newspaper Chain, Files for Bankruptcy",2020-02-13T12:54:49+0000,Business
3196,"Cole got support from his new manager, Aaron Boone, and denied any knowledge of cheating in Houston: “I certainly don’t think I have much to apologize for.”","At First Yankees Workout, Gerrit Cole Defends His Past With the Astros",2020-02-14T00:03:57+0000,Sports
3197,The mysterious firing of the department’s deputy secretary was the latest incident to shake the agency as it embarks on ambitious changes to health care.,"Veterans Affairs, a Trump Signature Issue, Is Facing Turmoil Again",2020-02-13T19:47:19+0000,Washington
3198,"State party officials released new details about their plans on Thursday, but after the chaos in Iowa, campaigns are worried that their months of effort in Nevada could go to waste.",The Nevada Caucuses Are Up Next. Will They Unfold Smoothly?,2020-02-13T10:00:25+0000,Politics
3199,"The Yannick Nézet-Séguin era begins in earnest, with the company’s music director leading six productions.",The Met Opera’s New Season: What We Want to See,2020-02-13T18:00:08+0000,Weekend
3200,"Corrections that appeared in print on Friday, Feb. 14, 2020","Corrections: Feb. 14, 2020",2020-02-14T04:31:46+0000,Corrections
3201,Our guide to pop and rock shows and the best of live jazz happening this weekend and in the week ahead.,"12 Pop, Rock and Jazz Concerts to Check Out in N.Y.C. This Weekend",2020-02-13T22:00:05+0000,Weekend
3202,Our guide to dance performances happening this weekend and in the week ahead.,6 Dance Performances to See in N.Y.C. This Weekend,2020-02-13T22:00:04+0000,Weekend
3203,"With many rooms (and stairs), a 19th-century house isn’t an easy place to grow old. But after 40 years in Park Slope, the owners wanted to stay put.","Making a Brownstone Accessible, Step by Step",2020-02-14T10:00:52+0000,Real Estate
3204,The same people who should be fixing them.,Who’s Profiting From Your Outrageous Medical Bills?,2020-02-14T10:00:32+0000,OpEd
3205,"His diverse body of work included novels, plays and a memoir about Ernest Hemingway. He was also a partner with his friend Paul Newman in business and charity.","A. E. Hotchner, Writer and Friend of the Famous, Dies at 102",2020-02-15T21:06:56+0000,Obits
3206,"After seven decades of experimentation, the artist produces “Unlights,” a confounding wonder — and possibly “my swan song.”",Robert Irwin’s Ambient Odyssey,2020-02-13T17:29:09+0000,Culture
3207,"Corrections that appeared in print on Thursday, Feb. 13, 2020.","Corrections: Feb. 13, 2020",2020-02-13T04:07:48+0000,Corrections
3208,"Quotation of the Day for Thursday, February 13, 2020.","Quotation of the Day: On Day 1, Yankees Vent About Astros",2020-02-13T04:18:55+0000,Summary
3209,"It’s one of the most common medical complaints, but patients say many doctors don’t take it seriously.",Why Doctors Dismiss Dizziness,2020-02-13T10:00:13+0000,Well
3210,"Prosecutors shared evidence, including explicit videos, against a father who is accused of abusing and extorting his daughter's college roommates.",What We Know About the Sarah Lawrence Trafficking Case,2020-02-13T10:22:43+0000,Metro
3211,See the looks from the Marc Jacobs: Fall 2020 Collection.,Marc Jacobs: Fall 2020,2020-02-13T02:04:46+0000,Fashion & Style
3212,"This week’s properties are in Park Slope, Brooklyn, Woodside, Queens, and on the Upper West Side.","Homes for Sale in Brooklyn, Queens and Manhattan",2020-02-13T14:00:24+0000,RealEstate
3213,Airbus can’t easily capitalize on the grounding of archrival Boeing’s best-selling plane.,"As Boeing Jets Sit Idle, Airbus Can’t Make Planes Fast Enough",2020-02-13T19:39:52+0000,Business
3214,"Under the plan, the hedge fund Chatham Asset Management would take over 30 newspapers nationwide, including The Sacramento Bee and The Miami Herald.","McClatchy, a Major U.S. Newspaper Chain, Files for Bankruptcy",2020-02-13T12:54:49+0000,Business
3215,The mysterious firing of the department’s deputy secretary was the latest incident to shake the agency as it embarks on ambitious changes to health care.,"Veterans Affairs, a Trump Signature Issue, Is Facing Turmoil Again",2020-02-13T19:47:19+0000,Washington
3216,"State party officials released new details about their plans on Thursday, but after the chaos in Iowa, campaigns are worried that their months of effort in Nevada could go to waste.",The Nevada Caucuses Are Up Next. Will They Unfold Smoothly?,2020-02-13T10:00:25+0000,Politics
3217,The actress’s “woo” approach to health is variously criticized and applauded. Also: Trump’s hostility to Europe; storing federal records.,"Gwyneth Paltrow’s Goop Arts, and Science",2020-02-13T20:03:22+0000,Letters
3218,"Cole got support from his new manager, Aaron Boone, and denied any knowledge of cheating in Houston: “I certainly don’t think I have much to apologize for.”","At First Yankees Workout, Gerrit Cole Defends His Past With the Astros",2020-02-14T00:03:57+0000,Sports
3219,"The Yannick Nézet-Séguin era begins in earnest, with the company’s music director leading six productions.",The Met Opera’s New Season: What We Want to See,2020-02-13T18:00:08+0000,Weekend
3220,"Corrections that appeared in print on Friday, Feb. 14, 2020","Corrections: Feb. 14, 2020",2020-02-14T04:31:46+0000,Corrections
3221,"In “Dark Towers,” David Enrich examines how unchecked ambition dethroned Deutsche Bank from its place at the forefront of German finance.",‘What the Hell Are We Doing Lending Money to a Guy Like This?’,2020-02-14T20:20:04+0000,BookReview
3222,A judge has ordered that the city revoke the building permit for 200 Amsterdam Avenue.,Developers of Upper West Side Condo Tower May Have to Deconstruct 20 Floors,2020-02-15T04:19:35+0000,Express
3223,It feels as if the 31-year-old actress has always been famous. But ‘High Fidelity’ and ‘The Batman’ are putting her at the center of the conversation.,"Sooner or Later, Zoë Kravitz Was Going to Be a Star",2020-02-13T10:00:23+0000,Arts&Leisure
3224,Planning for changes to the estate tax and the valuation discount for small businesses can be challenging. Here’s how to take advantage of them now.,2 Tax Strategies to Consider Ahead of the 2020 Election,2020-02-14T14:00:10+0000,Business
3225,Schools often use different jargon for the same types of aid or loans. Student advocates offer suggestions on how to figure out what you’ll pay.,Tips for Decoding College Financial Aid Offers,2020-02-14T14:00:10+0000,Business
3226,"Harvey Weinstein is accused of doing it to Annabella Sciorra and Mimi Haleyi. Years ago, a man did it to me.",The Specific Horror of Unwanted Oral Sex,2020-02-13T11:00:06+0000,OpEd
3227,It feels as if the 31-year-old actress has always been famous. But ‘High Fidelity’ and ‘The Batman’ are putting her at the center of the conversation.,"Sooner or Later, Zoë Kravitz Was Going to Be a Star",2020-02-13T10:00:23+0000,Arts&Leisure
3228,"In an era of opioid addiction, wellness obsession and internet oversharing, stories of substance abuse are back.",Addiction Memoirs Are a Genre in Recovery,2020-02-13T16:43:24+0000,Styles
3229,A brave voice in China cries out about the regime’s mishandling of the coronavirus.,‘I Cannot Remain Silent’,2020-02-15T19:30:04+0000,OpEd
3230,Readers share tips for avoiding the pitfalls of gender stereotypes in relationships.,"In Marriage, It’s Not About the Dishes. It’s About Respect.",2020-02-15T00:01:06+0000,OpEd
3231,The same people who should be fixing them.,Who’s Profiting From Your Outrageous Medical Bills?,2020-02-14T10:00:32+0000,OpEd
3232,"After seven decades of experimentation, the artist produces “Unlights,” a confounding wonder — and possibly “my swan song.”",Robert Irwin’s Ambient Odyssey,2020-02-13T17:29:09+0000,Culture
3233,"His diverse body of work included novels, plays and a memoir about Ernest Hemingway. He was also a partner with his friend Paul Newman in business and charity.","A. E. Hotchner, Writer and Friend of the Famous, Dies at 102",2020-02-15T21:06:56+0000,Obits
3234,"In “Dark Towers,” David Enrich examines how unchecked ambition dethroned Deutsche Bank from its place at the forefront of German finance.",‘What the Hell Are We Doing Lending Money to a Guy Like This?’,2020-02-14T20:20:04+0000,BookReview
3235,A judge has ordered that the city revoke the building permit for 200 Amsterdam Avenue.,Developers of Upper West Side Condo Tower May Have to Deconstruct 20 Floors,2020-02-15T04:19:35+0000,Express
3236,"Someday, before long, my wife and I will have to sit down and explain to him that he has a sister, and why she’s not here.",My Daughter Died. How Do I Introduce Her to My Son?,2020-02-13T09:50:02+0000,
3237,"Someday, before long, my wife and I will have to sit down and explain to him that he has a sister, and why she’s not here.",My Daughter Died. How Do I Introduce Her to My Son?,2020-02-13T10:00:08+0000,OpEd
3238,"It’s one of the most common medical complaints, but patients say many doctors don’t take it seriously.",Why Doctors Dismiss Dizziness,2020-02-13T10:00:13+0000,Well
3239,"Prosecutors shared evidence, including explicit videos, against a father who is accused of abusing and extorting his daughter's college roommates.",What We Know About the Sarah Lawrence Trafficking Case,2020-02-13T10:22:43+0000,Metro
3240,See the looks from the Marc Jacobs: Fall 2020 Collection.,Marc Jacobs: Fall 2020,2020-02-13T02:04:46+0000,Fashion & Style
3241,A ritual of the 1 percent endures in Manhattan.,The Debutante Ball in the Age of Instagram,2020-02-13T08:00:10+0000,Metro
3242,"As China continues its crackdown on ethnic minorities, including Uighur Muslims, as many as a million people have been detained in internment camps over three years.",Listen to Coverage From ‘The Daily’ on China’s Crackdown on Uighurs,2020-02-13T20:33:48+0000,Podcasts
3243,"Breaking hearts, brains and bank accounts since at least the 14th century.",Valentine’s Day: A Festival of Love or a Giant Scam?,2020-02-13T23:10:15+0000,OpEd
3244,"Harvey Weinstein is accused of doing it to Annabella Sciorra and Mimi Haleyi. Years ago, a man did it to me.",The Specific Horror of Unwanted Oral Sex,2020-02-13T11:00:06+0000,OpEd
3245,Planning for changes to the estate tax and the valuation discount for small businesses can be challenging. Here’s how to take advantage of them now.,2 Tax Strategies to Consider Ahead of the 2020 Election,2020-02-14T14:00:10+0000,Business
3246,"Kathie Klages, a former gymnastics coach at Michigan State University, could face up to four years in prison after being found guilty of lying to two investigators.",Former Coach Is Convicted of Lying About Knowledge of Abuse by Larry Nassar,2020-02-15T00:28:01+0000,Express
3247,"The New York City mayor, who was briefly a presidential candidate himself, is scheduled to campaign with Mr. Sanders in Nevada ahead of the caucuses there next week.",Bill de Blasio Endorses Bernie Sanders,2020-02-14T21:24:24+0000,Politics
3248,The Trump administration announced it would increase tariffs on European aircraft in an effort to ramp up pressure in a long-running airplane subsidy dispute.,Trump Administration Will Raise Tariffs on European Aircraft,2020-02-15T00:35:55+0000,Washington
3249,A quiet advisement against mingling and networking. ,Poem: At Least,2020-02-13T10:00:13+0000,Magazine
3250,"As test scores lag, there’s a growing debate between proponents of the “science of reading,” which emphasizes phonics, and traditional educators who prefer to instill a love of literature.",An Old and Contested Solution to Boost Reading Scores: Phonics,2020-02-15T08:00:10+0000,National
3251,"When California’s housing crisis slammed into a wealthy suburb, one public servant became a convert to a radically simple doctrine.",Build Build Build Build Build Build Build Build Build Build Build Build Build Build,2020-02-13T16:16:39+0000,SundayBusiness
3252,"Yes, the internet has changed the way we shop. But taken together, other factors have caused greater harm to traditional retail stores, an economist says.",Never Mind the Internet. Here’s What’s Killing Malls.,2020-02-13T10:00:17+0000,SundayBusiness
3253,Agreeing to see him again would require a minor miracle. A minor miracle is exactly what happened.,How My Worst Date Ever Became My Best,2020-02-14T05:00:09+0000,Styles
3254,Joe Biden sharply criticized Bernie Sanders as early voting began before next Saturday’s Nevada Democratic caucuses.,Biden Calls on Sanders to Show Accountability for ‘Outrageous’ Online Threats by Followers,2020-02-15T20:49:10+0000,Politics
3255,"As a girl, the author of “Wild” and “Tiny Beautiful Things” spent hours studying Scholastic book club catalogs. But “my family was too poor to pay for the books,” she says.",How Libraries Saved Cheryl Strayed,2020-02-13T10:00:03+0000,BookReview
3256,The pros and cons of hiring a broker who lives in the building.,Is It a Good Idea to Use an In-House Broker?,2020-02-14T14:00:08+0000,RealEstate
3257,"In “The Professor and the Parson,” Adam Sisman recounts the life of Robert Parkin Peters: bigamist, phony academic, “Romeo of the Church.”",How a Fake Priest Duped Oxford and a World-Famous Historian,2020-02-14T20:26:38+0000,BookReview
3258,"In “Dark Towers,” David Enrich examines how unchecked ambition dethroned Deutsche Bank from its place at the forefront of German finance.",‘What the Hell Are We Doing Lending Money to a Guy Like This?’,2020-02-14T20:20:04+0000,BookReview
3259,"After seven decades of experimentation, the artist produces “Unlights,” a confounding wonder — and possibly “my swan song.”",Robert Irwin’s Ambient Odyssey,2020-02-13T17:29:09+0000,Culture
3260,A judge has ordered that the city revoke the building permit for 200 Amsterdam Avenue.,Developers of Upper West Side Condo Tower May Have to Deconstruct 20 Floors,2020-02-15T04:19:35+0000,Express
3261,It feels as if the 31-year-old actress has always been famous. But ‘High Fidelity’ and ‘The Batman’ are putting her at the center of the conversation.,"Sooner or Later, Zoë Kravitz Was Going to Be a Star",2020-02-13T10:00:23+0000,Arts&Leisure
3262,"In an era of opioid addiction, wellness obsession and internet oversharing, stories of substance abuse are back.",Addiction Memoirs Are a Genre in Recovery,2020-02-13T16:43:24+0000,Styles
3263,"His diverse body of work included novels, plays and a memoir about Ernest Hemingway. He was also a partner with his friend Paul Newman in business and charity.","A. E. Hotchner, Writer and Friend of the Famous, Dies at 102",2020-02-15T21:06:56+0000,Obits
3264,A brave voice in China cries out about the regime’s mishandling of the coronavirus.,‘I Cannot Remain Silent’,2020-02-15T19:30:04+0000,OpEd
3265,"Someday, before long, my wife and I will have to sit down and explain to him that he has a sister, and why she’s not here.",My Daughter Died. How Do I Introduce Her to My Son?,2020-02-13T09:50:02+0000,
3266,The quintessential British boutique is turning 50 at a time when other famous stores are closing their doors.,The Secret to Browns’ Survival,2020-02-15T10:00:12+0000,Styles
3267,"A campaign of sponsored content for the candidate flourished suddenly on Instagram. A new outfit, called Meme 2020, is behind it.",Michael Bloomberg’s Campaign Suddenly Drops Memes Everywhere,2020-02-13T05:39:21+0000,Styles
3268,"Here are tips and recommendations on how to hire a C.P.A. or tax accountant near you — or further afield, if your local options are limited.",How to Find the Best C.P.A. or Tax Accountant Near You,2020-02-14T21:30:05+0000,Smarter Living
3269,"Someday, before long, my wife and I will have to sit down and explain to him that he has a sister, and why she’s not here.",My Daughter Died. How Do I Introduce Her to My Son?,2020-02-13T10:00:08+0000,OpEd
3270,"He ran on saving workers from automation, but also leaned into issues of race and representation.",How Andrew Yang Handled His Asian-American Identity on the Campaign Trail,2020-02-15T12:36:32+0000,National
3271,New York lawmakers appear poised to bow to the state’s law enforcement lobby and weaken a law that just took effect.,Give the New Bail Reform Law Time to Work,2020-02-15T19:30:06+0000,Editorial
3272,"The teenager, the second suspect arrested in the case, is believed to have wielded the murder weapon.",Tessa Majors Killing: 14-Year-Old Boy Charged With Murder,2020-02-15T17:26:21+0000,Metro
3273,The attorney general said that the president’s attacks on prosecutors’ handling of his friend Roger Stone’s sentencing undermine the legal system and the Justice Department.,Barr Says Attacks From Trump Make Work ‘Impossible’,2020-02-13T21:11:13+0000,Washington
3274,Trump allies are saying Stone didn’t really threaten a witness. They’re wrong.,The Right’s Big Lie About Roger Stone,2020-02-14T10:19:17+0000,OpEd
3275,"The ruling, written by a Reagan appointee, said the administration failed to show how such rules would help Medicaid to meet its mission of covering the poor.",Appeals Court Rejects Trump Medicaid Work Requirements in Arkansas,2020-02-14T21:30:13+0000,Science
3276,"Sam Ezersky, how do we solve thee? Comptons les façons.",Number Theory,2020-02-15T22:40:03+0000,Games
3277,A quiet advisement against mingling and networking. ,Poem: At Least,2020-02-13T10:00:13+0000,Magazine
3278,"His 657 home runs and 1,988 runs batted in were second in the nation’s history, as were his 2,901 hits and 3,017 games. He also had success as a manager.","Katsuya Nomura, 84, Enduring Star of Japanese Baseball, Dies",2020-02-13T19:53:36+0000,Obits
3279,"Xi Jinping was aware of the outbreak nearly two weeks before he first spoke publicly about it. It could draw him directly into questions about whether officials did too little, too late.","China’s Leader, Under Fire, Says He Led Coronavirus Fight Early On",2020-02-15T23:02:07+0000,Foreign
3280,"The mother-daughter duo model layered, eclectic looks that have a carefree air — even though they took a whole team to assemble.",Pat and Anna Cleveland Pile on Spring Fashions,2020-02-14T14:00:12+0000,TStyle
3281,"After raids in six states on Friday morning, federal prosecutors arrested 12 men, one of them a police employee.",Germany Says It’s Broken Up a Far-Right Terrorism Network,2020-02-14T19:18:10+0000,Foreign
3282,"A campaign of sponsored content for the candidate flourished suddenly on Instagram. A new outfit, called Meme 2020, is behind it.",Michael Bloomberg’s Campaign Suddenly Drops Memes Everywhere,2020-02-13T05:39:21+0000,Styles
3283,"Here are tips and recommendations on how to hire a C.P.A. or tax accountant near you — or further afield, if your local options are limited.",How to Find the Best C.P.A. or Tax Accountant Near You,2020-02-14T21:30:05+0000,Smarter Living
3284,Randolph Ross presents a capital puzzle on a celebratory day.,Takes Stock?,2020-02-15T02:40:02+0000,Games
3285,A new romantic comedy debuts on Freeform. And the childhood story of a girl and her dog comes to Disney Plus.,What’s on TV Saturday: ‘The Thing About Harry’ and ‘Winn-Dixie’,2020-02-15T06:00:08+0000,Culture
3286,"Corrections that appeared in print on Saturday, Feb. 15, 2020.","Corrections: Feb. 15, 2020",2020-02-15T04:27:56+0000,Corrections
3287,There are “only” eight candidates left in the Democratic primary and we still do not know who won Iowa. Here is a recap of what you might have missed from a busy week in the Democratic primary.,The Fallout From New Hampshire: This Week in the 2020 Race,2020-02-15T10:00:10+0000,Politics
3288,"Amid mounting furor over politicization at the Justice Department, the attorney general ordered reviews of such investigations and prosecutions.",William Barr Moves to Take the Reins of Politically Charged Cases,2020-02-15T00:52:14+0000,Washington
3289,"The husband and wife, both in their 60s, were confirmed to have the virus after returning home to Japan. Officials in Hawaii were racing to find people they may have met in the state.",Couple Tests Positive for Coronavirus After Returning From Vacation in Hawaii,2020-02-15T00:53:16+0000,National
3290,What happens when the left cedes the free speech high ground?,Trump’s Whisper Network,2020-02-15T01:11:03+0000,OpEd
3291,"Quotation of the Day for Sunday, February 16, 2020.",Quotation of the Day: Non-Cheating Champions Gear Up for the Season,2020-02-16T04:40:48+0000,Summary
3292,The couple met 20 years ago through a mutual friend and reconnected in 2017 through a dating app.,"Kanika Shah, Vikram Singh",2020-02-16T05:15:00+0000,Society
3293,The couple met in 2015 on OkCupid.,"Noah Mamis, Jason Ziplow",2020-02-16T05:15:00+0000,Society
3294,Facebook’s Mark Zuckerberg and Google’s Sundar Pichai have journeyed to Brussels as the European Union drafts regulation for A.I. and the digital economy.,"Silicon Valley Heads to Europe, Nervous About New Rules",2020-02-16T19:43:35+0000,Business
3295,Passengers and crew members quarantined off Japan were told by the American Embassy that a chartered flight would arrive on Sunday to take them back to the United States.,U.S. Says It Will Evacuate Americans From Cruise Ship,2020-02-15T05:13:20+0000,Foreign
3296,"China’s National Health Commission on Monday reported 2,048 new cases of coronavirus infections and 105 new deaths over the previous 24 hours.",Rate of New Fatalities Drops in China,2020-02-16T05:13:26+0000,Foreign
3297,See the looks from the Richard Quinn: Fall 2020 Collection.,Richard Quinn: Fall 2020,2020-02-15T21:42:12+0000,Fashion & Style
3298,His Democratic rivals are trying to capitalize.,The Next Hurdle for Bernie Sanders: Nevada’s Top Union Dislikes ‘Medicare for All’,2020-02-16T18:22:35+0000,Politics
3299,The Education Department has a powerful complaint resolution path that is kept largely out of sight.,The Student Loan Appeal Process the Government Doesn’t Tell You About,2020-02-17T16:02:38+0000,Business
3300,"More entrepreneurs are pursuing social or environmental goals, but they still have to find a successful product or service to sell.",Learning to Balance Profit With a Social Mission,2020-02-16T21:42:40+0000,Business
