id,the_snippet,the_headline,the_date,the_news_desk
2118,"While parents have been focusing on creating Instagram-friendly school lunches, the quality of cafeteria food has improved significantly.",Why Are You Still Packing Lunch for Your Kids?,2020-02-10T10:00:16+0000,OpEd
2119,Parents feel emotionally and financially stressed by caring for young children and older relatives at the same time.,‘It’s Pretty Brutal’: The Sandwich Generation Pays a Price,2020-02-11T20:26:15+0000,Parenting
2120,"Workers can’t return to their jobs as supply lines get snarled, extending the forced holiday and fracturing the country.",‘Like Europe in Medieval Times’: Virus Slows China’s Economy,2020-02-10T18:45:32+0000,Business
2121,"For Jeff Sessions, Roy Moore and other Republicans vying for a chance to take back Doug Jones’s seat, winning over voters may mean winning over the president first.",How Alabama’s Senate Primary Became a Trump Loyalty Contest,2020-02-10T14:53:47+0000,Magazine
2122,"As the former New York City mayor starts to rise in the polls as a Democratic presidential candidate, an audio recording of him defending the policy in 2015 is circulating widely on social media.",Bloomberg’s Blunt Defense of Stop-and-Frisk Policy Draws Scrutiny,2020-02-11T15:47:14+0000,Politics
2123,"The New York Times writers and critics Dave Itzkoff, Cara Buckley and Wesley Morris provided live commentary during the 92nd Academy Awards. Read their reactions and analysis.",Oscars 2020: Highlights and Analysis,2020-02-10T00:33:34+0000,Movies
2124,"While parents have been focusing on creating Instagram-friendly school lunches, the quality of cafeteria food has improved significantly.",Why Are You Still Packing Lunch for Your Kids?,2020-02-10T10:00:16+0000,OpEd
2125,President Trump had complained that the recommendation of seven to nine years in prison for his former adviser and longtime friend was a “miscarriage of justice.”,Prosecutors Quit Roger Stone Case After Justice Dept. Intervenes on Sentencing,2020-02-11T17:44:14+0000,Washington
2126,"She created one of the most enduring images of the 20th century, but she also created a new model for her discipline.",How Dorothea Lange Defined the Role of the Modern Photojournalist,2020-02-10T21:33:53+0000,TStyle
2127,See the looks from the Brandon Maxwell: Fall 2020 Collection.,Brandon Maxwell: Fall 2020,2020-02-09T03:03:59+0000,Fashion & Style
2128,"Hosted by RuPaul and featuring Justin Bieber as musical guest, this week’s show also had another memorable Oscar segment.",‘S.N.L.’ Takes Aim at the Democratic Debate and Trump’s Acquittal,2020-02-09T07:22:37+0000,Culture
2129,See the looks from the Tory Burch : Fall 2020 Collection.,Tory Burch: Fall 2020,2020-02-09T16:50:24+0000,Fashion & Style
2130,"The couple met at Cornell, from which they graduated.","Jamie Linker, Christopher Tems",2020-02-09T05:15:00+0000,Society
2131,"Once ostracized over its ties to sectarian violence, Sinn Fein may now be able to claim a seat at the government table.",Sinn Fein on Threshold: Party With Old I.R.A. Ties Soars in Irish Election,2020-02-10T00:29:45+0000,Foreign
2132,"Quotation of the Day for Sunday, February 9, 2020.",Quotation of the Day: Can Alabamians See Past Trump’s Disdain For Sessions?,2020-02-09T04:06:18+0000,Summary
2133,"The couple met at Cornell, from which they graduated.","Jamie Linker, Christopher Tems",2020-02-09T05:15:00+0000,Society
2134,"Hosted by RuPaul and featuring Justin Bieber as musical guest, this week’s show also had another memorable Oscar segment.",‘S.N.L.’ Takes Aim at the Democratic Debate and Trump’s Acquittal,2020-02-09T07:22:37+0000,Culture
2135,See the looks from the Brandon Maxwell: Fall 2020 Collection.,Brandon Maxwell: Fall 2020,2020-02-09T03:03:59+0000,Fashion & Style
2136,See the looks from the Tory Burch : Fall 2020 Collection.,Tory Burch: Fall 2020,2020-02-09T16:50:24+0000,Fashion & Style
2137,Let us help you start your day. ,"Thailand, Coronavirus, Trump: Your Monday Briefing",2020-02-09T21:51:17+0000,NYTNow
2138,A teaser trailer for the latest season of the National Geographic anthology series offered a first look at Erivo’s portrayal of the Queen of Soul.,‘Genius’ Trailer: Cynthia Erivo Plays Aretha Franklin,2020-02-10T04:15:35+0000,Culture
2139,"The flight, which took four hours and 56 minutes, reached a top speed of 825 miles per hour, according to flight-tracking data.",British Airways Sets Record for Fastest Subsonic Flight From New York to London,2020-02-10T02:25:38+0000,Express
2140,"To mark the sixth annual international day of prayer and awareness against human trafficking, nuns and lay people took to the streets.","In Fight to Stop Human Trafficking, Nuns Take to the Streets",2020-02-09T16:36:12+0000,Foreign
2141,Bundles and 135 million streams returned the rapper to the top of the Billboard 200.,Lil Wayne Scores His Fifth No. 1 Album With ‘Funeral’,2020-02-10T19:09:13+0000,Culture
2142,"Quotation of the Day for Tuesday, February 11, 2020.",Quotation of the Day: Virus Lockdown Stifles Economy in a Wary China,2020-02-11T04:52:54+0000,Summary
2143,One reader says the firings confirm the need for whistle-blowers to remain anonymous. Another explains why the president can target New Yorkers with impunity.,"Trump’s Reprisals: Firing Witnesses, Punishing New York",2020-02-10T21:51:48+0000,Letters
2144,Here’s what you need to know.,"Coronavirus, Germany, Storm Ciara: Your Tuesday Briefing",2020-02-11T05:54:15+0000,NYTNow
2145,"An excerpt from “The Resisters,” by Gish Jen","‘The Resisters,’ by Gish Jen: An Excerpt",2020-02-11T10:01:00+0000,BookReview
2146,"An excerpt from “Smacked: A Story of White-Collar Ambition, Addiction, and Tragedy,” by Eilene Zimmerman","‘Smacked: A Story of White-Collar Ambition, Addiction, and Tragedy,’ by Eilene Zimmerman: An Excerpt",2020-02-11T10:01:00+0000,BookReview
2147,"After a rampage in the Bronx, a police union and even President Trump blamed Mayor de Blasio for fostering an anti-police atmosphere.","A Brazen Gunman, 2 N.Y.P.D. Officers Shot and the Fallout",2020-02-11T10:15:24+0000,Metro
2148,"Do these visual messages allow you to laugh about school, friendships or what your parents expect from you? Do they quickly inform you about the news — and make the world less scary? Or do they too often cross the line?",Do Memes Make the Internet a Better Place?,2020-02-11T10:00:07+0000,Learning
2149,"Boko Haram fighters in Nigeria’s northeastern Borno region set ablaze several trucks carrying passengers on Sunday night, eyewitnesses and residents told Reuters.",Suspected Boko Haram Fighters Kill at Least 30 in Nigeria,2020-02-10T23:05:43+0000,Foreign
2150,Here's what you need to know.,"Coronavirus, New Hampshire, T-Mobile: Your Tuesday Briefing",2020-02-11T10:39:22+0000,NYTNow
2151,"Quotation of the Day for Tuesday, February 11, 2020.",Quotation of the Day: Virus Lockdown Stifles Economy in a Wary China,2020-02-11T04:52:54+0000,Summary
2152,This word has appeared in 19 articles on NYTimes.com in the past year.,Word + Quiz: brackish,2020-02-11T07:00:02+0000,Learning
2153,A novel financial instrument was supposed to bring Europe strategic autonomy from the United States. Its muted debut only shows how far-off that goal really is.,The Failure of Europe’s Feeble Muscle Flexing,2020-02-10T10:00:16+0000,OpEd
2154,The top-ranked Gamecocks won their 17th consecutive game by defeating the fifth-ranked Huskies.,South Carolina Gets Its First Win Ever Against UConn,2020-02-11T04:59:41+0000,Sports
2155,One reader says the firings confirm the need for whistle-blowers to remain anonymous. Another explains why the president can target New Yorkers with impunity.,"Trump’s Reprisals: Firing Witnesses, Punishing New York",2020-02-10T21:51:48+0000,Letters
2156,Here’s what you need to know.,"Coronavirus, Germany, Storm Ciara: Your Tuesday Briefing",2020-02-11T05:54:15+0000,NYTNow
2157,"An excerpt from “The Resisters,” by Gish Jen","‘The Resisters,’ by Gish Jen: An Excerpt",2020-02-11T10:01:00+0000,BookReview
2158,"An excerpt from “Smacked: A Story of White-Collar Ambition, Addiction, and Tragedy,” by Eilene Zimmerman","‘Smacked: A Story of White-Collar Ambition, Addiction, and Tragedy,’ by Eilene Zimmerman: An Excerpt",2020-02-11T10:01:00+0000,BookReview
2159,"A federal judge is expected to approve the $26 billion deal imminently. The bankers will be happy; California and New York officials, not so much.",The Winners and Losers From T-Mobile and Sprint’s Merger Saga,2020-02-11T12:09:34+0000,Business
2160,"As the United States women’s national soccer team prepares for the Tokyo Olympics, its players are waging daily battles for a limited number of roster spots.","‘It’s Cutthroat’: U.S. Women Beat Canada in Soccer, With Fight Ahead",2020-02-09T21:16:12+0000,Sports
2161,"For months, the two candidates had rarely faced off in direct attacks. But now, as the polling leaders, they are using the other as a foil to press their divergent cases for the presidency.",Sanders and Buttigieg Close Out New Hampshire Pitching Different Visions,2020-02-10T23:51:15+0000,Politics
2162,"The gunman operated in a military whose officers often have outside businesses and take advantage of lower-ranking soldiers. He killed 29 people, the worst shooting in recent Thai history.",Thai Soldier in Mass Shooting Had Business Clash With His Commander,2020-02-10T18:36:24+0000,Foreign
2163,"Claude McKay’s “Romance in Marseille,” published decades after it was written, tackles race and migration in a globally connected world much like our own.",A Legless Black Man Comes Into a Windfall in This Biting Satire,2020-02-11T15:36:28+0000,BookReview
2164,Here’s how important New Hampshire is to the 10 Democrats mounting competitive efforts there.,What’s at Stake in the New Hampshire Primary,2020-02-11T10:00:04+0000,U.S.
2165,Education Secretary Betsy DeVos’s contentious regulations on sexual misconduct at schools will cement domestic and dating violence and stalking as forms of gender discrimination.,New Campus Sexual Misconduct Rules Will Tackle Dating Violence,2020-02-10T15:38:12+0000,Washington
2166,"After a rampage in the Bronx, a police union and even President Trump blamed Mayor de Blasio for fostering an anti-police atmosphere.","A Brazen Gunman, 2 N.Y.P.D. Officers Shot and the Fallout",2020-02-11T10:15:24+0000,Metro
2167,"Boko Haram fighters in Nigeria’s northeastern Borno region set ablaze several trucks carrying passengers on Sunday night, eyewitnesses and residents told Reuters.",Suspected Boko Haram Fighters Kill at Least 30 in Nigeria,2020-02-10T23:05:43+0000,Foreign
2168,"Do these visual messages allow you to laugh about school, friendships or what your parents expect from you? Do they quickly inform you about the news — and make the world less scary? Or do they too often cross the line?",Do Memes Make the Internet a Better Place?,2020-02-11T10:00:07+0000,Learning
2169,Here's what you need to know.,"Coronavirus, New Hampshire, T-Mobile: Your Tuesday Briefing",2020-02-11T10:39:22+0000,NYTNow
2170,Aravind Adiga’s new novel is about a Sri Lankan man trying to find his place in Australia who might have useful information about a murder.,"In ‘Amnesty,’ an Immigrant’s View Conveyed With Authority and Wit",2020-02-10T19:16:46+0000,Culture
2171,"As Bong Joon Ho’s film received Academy Awards for best picture and best director, the honors set off cheers and a burst of pride in a country fearful of being overlooked.",Oscar for ‘Parasite’ Quenches Koreans’ Long Thirst for Recognition,2020-02-10T10:58:54+0000,Culture
2172,"The president’s spending proposal requests money for a new arms race with Russia and China, and restores nuclear weapons as central to military policy.",Trump Budget Calls for New Nuclear Warheads and 2 Types of Missiles,2020-02-11T00:45:06+0000,Washington
2173,"With its bluffs, canyons and beaches, the affluent neighborhood north of Santa Monica attracts buyers with its natural treasures as well as its strong schools and uncrowded streets.","Pacific Palisades, Los Angeles: Where Mountains Meet the Sea",2020-02-11T14:00:24+0000,RealEstate
2174,"The state has its challenges, but it’s no Iowa.","Introducing the Needle, the New Hampshire Version",2020-02-11T21:31:27+0000,Upshot
2175,"Two new books challenge the assumption that it’s impossible to reach that kid with the wispy mustache. In fact, reaching him is more important than ever.","The Myth of the Silent, Sulky, Horny Teenage Boy",2020-02-11T10:00:16+0000,BookReview
2176,"Democratic presidential candidates have been visiting New Hampshire for more than a year to convince residents they are deserving of a vote. On Tuesday, it was finally time to step into the booth and make a choice. See the day in photos.","At Last, It’s Time for New Hampshire to Vote",2020-02-11T22:43:37+0000,U.S.
2177,They hold the fate of the party in their hands. And maybe not only their party.,New Hampshire Democrats Aren’t Just Voting,2020-02-11T10:00:16+0000,OpEd
2178,The indictment suggests that the breach was part of a series of thefts by China to use the data to target American officials.,U.S. Charges Chinese Military Officers in 2017 Equifax Hacking,2020-02-10T15:29:54+0000,Washington
2179,"The island has a long history of encouraging residents to identify as white, but there are growing efforts to raise awareness about racism.",Why Some Black Puerto Ricans Choose ‘White’ on the Census,2020-02-09T10:00:10+0000,National
2180,"The museum, nine decades in the making and costing at least $388 million, was originally set to open in 2017.",Motion Picture Academy Museum Will Open in December,2020-02-10T03:21:45+0000,Business
2181,"The patient, one of hundreds evacuated by the U.S. from China, was released from a San Diego hospital to quarantine before the mistake was discovered, health officials said.",Labeling Error to Blame for Hospital’s Release of Coronavirus Patient,2020-02-11T17:49:18+0000,National
2182,A software engineer finds herself unable to return to her job in Hong Kong after the Philippine government banned travel to the city.,"A Job Overseas, but Stranded by Coronavirus Travel Bans",2020-02-10T13:19:32+0000,Business
2183,"A handful of buildings around the world have been linked to multiple cases of the new virus, raising fears of rapid transmission.","A Store, a Chalet, an Unsealed Pipe: Coronavirus Hot Spots Flare Far From Wuhan",2020-02-11T22:41:21+0000,Foreign
2184,"As a child in Austin, Texas, he admired the house from afar. As an adult, he made it his own.",The Midcentury-Modern House on the Hill,2020-02-11T10:00:36+0000,Real Estate
2185,See the looks from the Gabriela Hearst: Fall 2020 Collection.,Gabriela Hearst: Fall 2020,2020-02-11T19:26:47+0000,Fashion & Style
2186,Nari showcases Pim Techamuanvivit’s personal vision of Thai cuisine.,Haute Thai,2020-02-11T16:19:23+0000,Food
2187,"The president, who lost the state by a few thousand votes in 2016, now has the support of the Republican establishment. But not all Republicans are convinced.","Democrats Get the Attention, but Trump Aims to Put New Hampshire in Play",2020-02-11T22:01:28+0000,Politics
2188,Volunteers and activists in rural towns and swing counties are demoralized but still vow to turn out in November.,Can Iowa’s Democrats Rebound From the Caucus Fiasco?,2020-02-11T17:14:01+0000,National
2189,"In “Che Malambo,” a Frenchman has taken a folkloric Argentine form and turned it into grand spectacle.",Adding Razzle-Dazzle to a Gaucho Dance Style,2020-02-11T17:04:07+0000,Culture
2190,He should be allowed back into baseball and be eligible for the Hall of Fame.,Pete Rose Has Done His Time,2020-02-11T20:00:09+0000,OpEd
2191,Some artists say Desert X AlUla is a step toward changing Saudi society. Critics call the government-funded exhibition “morally corrupt.”,"Art Rises in the Saudi Desert, Shadowed by Politics",2020-02-11T20:34:17+0000,Culture
2192,"At the Schindler House, a celebration of art, design and fermentation.","In Los Angeles, a Historic Home Becomes an Experimental Kitchen",2020-02-11T17:03:33+0000,TStyle
2193,Years struggling to balance parenting duties with my sick parents’ needs left me financially adrift.,Caring for Two Generations Almost Cost Me My Career,2020-02-11T20:27:39+0000,Parenting
2194,The truth about so-called domestic terrorism? There is nothing domestic about it.,We Once Fought Jihadists. Now We Battle White Supremacists.,2020-02-11T20:00:08+0000,OpEd
2195,"With its bluffs, canyons and beaches, the affluent neighborhood north of Santa Monica attracts buyers with its natural treasures as well as its strong schools and uncrowded streets.","Pacific Palisades, Los Angeles: Where Mountains Meet the Sea",2020-02-11T14:00:24+0000,RealEstate
2196,"There are more useful things to do than worry. For one thing, you could wash your hands. (And did you get your flu shot?)",Lessons That Go Beyond the Coronavirus Outbreak,2020-02-10T10:00:13+0000,Upshot
2197,"The state has its challenges, but it’s no Iowa.","Introducing the Needle, the New Hampshire Version",2020-02-11T21:31:27+0000,Upshot
2198,"Two new books challenge the assumption that it’s impossible to reach that kid with the wispy mustache. In fact, reaching him is more important than ever.","The Myth of the Silent, Sulky, Horny Teenage Boy",2020-02-11T10:00:16+0000,BookReview
2199,"Democratic presidential candidates have been visiting New Hampshire for more than a year to convince residents they are deserving of a vote. On Tuesday, it was finally time to step into the booth and make a choice. See the day in photos.","At Last, It’s Time for New Hampshire to Vote",2020-02-11T22:43:37+0000,U.S.
2200,They hold the fate of the party in their hands. And maybe not only their party.,New Hampshire Democrats Aren’t Just Voting,2020-02-11T10:00:16+0000,OpEd
2201,The victory for Bong Joon Ho’s film at the Oscars has nothing to do with representation of people like me.,"‘Parasite’ Won, but Asian-Americans Are Still Losing",2020-02-11T00:43:50+0000,OpEd
2202,"Modern Love in miniature, featuring reader-submitted stories of no more than 100 words.",Tiny Love Stories: ‘We Entered the Stormy Landscape of Polyamory’,2020-02-11T20:00:09+0000,Styles
2203,Some artists say Desert X AlUla is a step toward changing Saudi society. Critics call the government-funded exhibition “morally corrupt.”,"Art Rises in the Saudi Desert, Shadowed by Politics",2020-02-11T20:34:17+0000,Culture
2204,"Detailed results and maps from the New Hampshire primary election, the second contest of the 2020 presidential election.",New Hampshire 2020 Primary: Live Results,2020-02-11T22:36:25+0000,U.S.
2205,"A selection of recent audiobooks of note; plus, a peek at what our colleagues around the newsroom are reading.","New & Noteworthy Audiobooks, From Caffeine to the Space Race",2020-02-11T10:00:13+0000,BookReview
2206,"One site disturbed by the construction, which is taking place in a UNESCO ecological preserve, is a resting place for Apache warriors.",Blasting in Construction of Border Wall Is Affecting Tribal Areas,2020-02-11T19:34:12+0000,Express
2207,Jim Walmsley has smashed records at 50 and 100 miles. Now he hopes to make the Olympics in a distance he’s never run: 26.2 miles.,Can the King of Ultrarunning Conquer a Race as Short as the Marathon?,2020-02-11T10:00:23+0000,Magazine
2208,"Brad Pitt, Bong Joon Ho, Renée Zellweger and Joaquin Phoenix at the Governors Ball and the Vanity Fair party.",Inside the 2020 Oscar Parties,2020-02-10T16:05:34+0000,Styles
2209,"Adrienne Miller’s memoir chronicles her tenure as fiction editor of Esquire in the 1990s and her rocky relationship with David Foster Wallace, the era’s iconic novelist.",Sexism and Genius Collide ‘In the Land of Men’,2020-02-11T10:00:08+0000,BookReview
2210,How to think beyond the basic bouquet and incorporate blooms into everything from headdresses to home-cooked meals.,"For Valentine’s Day, Nine Stories About Flowers",2020-02-11T15:00:10+0000,TStyle
2211,The truth about so-called domestic terrorism? There is nothing domestic about it.,We Once Fought Jihadists. Now We Battle White Supremacists.,2020-02-11T20:00:08+0000,OpEd
2212,"As a child in Austin, Texas, he admired the house from afar. As an adult, he made it his own.",The Midcentury-Modern House on the Hill,2020-02-11T10:00:36+0000,Real Estate
2213,A friend of Jessica Mann’s testified for the defense that Ms. Mann had a relationship with the producer and never said that he raped her.,"Weinstein Accuser Called Him Her ‘Spiritual Soul Mate,’ Witness Says",2020-02-10T18:09:21+0000,Metro
2214,A new history follows the icons and socialites of the Côte d’Azur before the rise of fascism.,It Was ‘Chanel’s Riviera’ in the 1930s. Then Came World War II.,2020-02-11T10:25:00+0000,BookReview
2215,"A handful of buildings around the world have been linked to multiple cases of the new virus, raising fears of rapid transmission.","A Store, a Chalet, an Unsealed Pipe: Coronavirus Hot Spots Flare Far From Wuhan",2020-02-11T22:41:21+0000,Foreign
2216,A software engineer finds herself unable to return to her job in Hong Kong after the Philippine government banned travel to the city.,"A Job Overseas, but Stranded by Coronavirus Travel Bans",2020-02-10T13:19:32+0000,Business
2217,Critics say the government is making a coronavirus episode worse by not being more forthcoming.,Quarantined Cruise Passengers Have Many Questions. Japan Has Few Answers.,2020-02-11T23:53:33+0000,Foreign
2218,"The patient, one of hundreds evacuated by the U.S. from China, was released from a San Diego hospital to quarantine before the mistake was discovered, health officials said.",Labeling Error to Blame for Hospital’s Release of Coronavirus Patient,2020-02-11T17:49:18+0000,National
2219,Jim Walmsley has smashed records at 50 and 100 miles. Now he hopes to make the Olympics in a distance he’s never run: 26.2 miles.,Can the King of Ultrarunning Conquer a Race as Short as the Marathon?,2020-02-11T10:00:23+0000,Magazine
2220,"One site disturbed by the construction, which is taking place in a UNESCO ecological preserve, is a resting place for Apache warriors.",Blasting in Construction of Border Wall Is Affecting Tribal Areas,2020-02-11T19:34:12+0000,Express
2221,"Look closely at this image, stripped of its caption, and join the moderated conversation about what you and other students see.","What’s Going On in This Picture? | Feb. 10, 2020",2020-02-09T22:00:02+0000,Learning
2222,The truth about so-called domestic terrorism? There is nothing domestic about it.,We Once Fought Jihadists. Now We Battle White Supremacists.,2020-02-11T20:00:08+0000,OpEd
2223,"A handful of buildings around the world have been linked to multiple cases of the new virus, raising fears of rapid transmission.","A Store, a Chalet, an Unsealed Pipe: Coronavirus Hot Spots Flare Far From Wuhan",2020-02-11T22:41:21+0000,Foreign
2224,"As a child in Austin, Texas, he admired the house from afar. As an adult, he made it his own.",The Midcentury-Modern House on the Hill,2020-02-11T10:00:36+0000,Real Estate
2225,"The author’s father died six weeks before her wedding, and because he wanted no memorial service, she wondered: “How could we honor my dad without turning our wedding into a funeral?”",The Wedding That Wasn’t Sad,2020-02-11T16:19:35+0000,Styles
2226,Pregnant women who take a daily baby aspirin may reduce the risk for premature birth.,A Daily Aspirin for Pregnancy?,2020-02-11T10:00:12+0000,Well
2227,"Stealing military secrets, plotting a presidential assassination, spreading disinformation: It’s all in a day’s work in these recent titles.",Rounding Up the Spies of World War II in 4 New Books,2020-02-11T21:49:28+0000,BookReview
2228,Madeline Levine’s new book has a message for anyone raising kids: Get squiggly.,"Tiger, Snowplow, Helicopter and Free-Range Parents, Listen Up!",2020-02-11T10:00:18+0000,BookReview
2229,"In “The King at the Edge of the World,” by Arthur Phillips, a Muslim physician becomes a pawn in a game of international political chess.","A Rich, Old-Fashioned Spy Thriller Set in Elizabethan England",2020-02-11T10:00:10+0000,BookReview
2230,Here’s what you need to know at the end of the day.,"Democrats, Roger Stone, Condé Nast: Your Wednesday Evening Briefing",2020-02-12T23:37:36+0000,NYTNow
2231,"For decades, Gabriel Matzneff wrote openly of his pedophilia, protected by powerful people in publishing, journalism, politics and business. Now cast out, he attacks their “cowardice” in a rare interview.",A Pedophile Writer Is on Trial. So Are the French Elites.,2020-02-11T10:05:18+0000,Foreign
2232,Readers express fear that Bernie Sanders is “the dream candidate for Donald Trump” and assess the strengths and weaknesses of the other contenders.,"The Democrats, After New Hampshire",2020-02-12T19:50:36+0000,Letters
2233,"“If anyone’s in the market for some Joe Biden campaign merchandise, I think it’s about to get a whole lot cheaper,” Jimmy Fallon joked on Tuesday.",Late Night Takes On Joe Biden’s Cold Shoulder in New Hampshire,2020-02-12T07:51:05+0000,Culture
2234,Roenicke was promoted to interim manager less than 24 hours before Boston had its first spring training workout. He has his work cut out for him after a winter of turmoil.,"Without Betts and Cora, Ron Roenicke Embraces Red Sox’s Challenges",2020-02-12T22:10:47+0000,Sports
2235,Parris Goebel is the 28-year-old choreographer behind Jennifer Lopez’s Super Bowl halftime show.,The Hidden M.V.P. of the Super Bowl? J. Lo’s Choreographer,2020-02-12T19:55:49+0000,Sports
2236,"In “The Lodge” and “Swallow,” two would-be mothers terrify with willful anti-maternal actions.",When Moms Attack,2020-02-12T14:00:06+0000,Culture
